MASP,TENSP,LOAISP,TRANGTHAI,NGAYMO,NGAYDONG
THANTAI2023.TT,Sản phẩm tiết kiệm thần tài trả trước,Tết nguyên đán 2023,Closed,12/1/2022,2/28/2023
THANTAI2023.TS,Sản phẩm tiết kiệm thần tài trả sau,Tết nguyên đán 2023,Closed,12/1/2022,2/28/2023
TIETKIEMDUTHUONG,Tiết kiệm dự thưởng,,Open,1/1/2023,NULL
TK-THUONG.TT,Tiết kiệm thường trả trước,,Open,10/12/2019,NULL
TK-THUONG.TS,Tiết kiệm thường trả sau,,Open,10/12/2019,NULL
TK-TICHLUY,Tiết kiệm tích lũy,,Open,4/22/2018,NULL
TK-ONLINE.TT,Tiết kiệm online trả trước,,Open,12/28/2021,NULL
TK-ONLINE.TS,Tiết kiệm online trả sau,,Open,10/7/2021,NULL
TK-ONGVANG,Tiết kiệm ong vàng,,Open,9/22/2021,NULL
TK-MANGNON,Tiết kiệm măng non,,Open,10/22/2021,NULL
TK-UUTIEN,Tiết kiệm khách hàng ưu tiên,,Open,3/15/2014,NULL
TK-RUTGOCTUNGPHAN,Tiết kiệm rút gốc từng phần,,Open,3/22/2021,NULL
THANTAI2024.TT,Sản phẩm tiết kiệm thần tài trả trước,Tết nguyên đán 2024,Closed,12/1/2023,3/31/2024
THANTAI2024.TS,Sản phẩm tiết kiệm thần tài trả sau,Tết nguyên đán 2024,Closed,12/1/2023,3/31/2024
